source,content,headline,date_published
"{'id': None, 'name': 'Forbes'}","Seismic change may hit publishing as Gen Zs rise coincides with AIs ascendance.
getty
Over millennia, the publishing industry has cycled through skepticism, experimentation, iteration, innovation, … [+4255 chars]",Part 1: 5 Ways AI Can Transform How Publishing Operates,2024-06-19T14:35:22Z
"{'id': None, 'name': 'Forbes'}","They say all good things must come to an end. And that includes tried and true digital marketing strategies that were once dependable but have lost their effectiveness.
Why dont conventional marketi… [+6603 chars]",Performance Publishing: Quality Media’s Strategy For Winning Customers,2024-06-20T10:00:00Z
"{'id': None, 'name': 'Forbes'}","Nathan Myrhvold tries to explain, in great detail, how to make the perfect bread at home.
Modernist Cuisine
As if billionaire scientist, technologist and inventor Dr. Nathan Myhrvold didnt have eno… [+8698 chars]","After Publishing Five Volumes Of Modernist Bread, Nathan Myhrvold Adds One For Home Baking, Part One",2024-07-01T13:57:27Z
"{'id': None, 'name': 'Forbes'}","Large language models can discern stylistic patterns from sample texts with remarkable accuracy.
getty
In my previous blog, I outlined five ways in which publishing can, and likely will, use AI to … [+3295 chars]",Part 2: 5 Ways AI Can Transform How Publishing Sells Books,2024-07-01T14:00:53Z
"{'id': 'usa-today', 'name': 'USA Today'}","Purchases you make through our links may earn us and our publishing partners a commission.
We finally know when Amazon Prime Day 2024 is happening. The retail giant just unveiled all the deets on Pr… [+5132 chars]",When is Amazon Prime Day 2024? The best Amazon deals are coming July 16 and 17,2024-06-25T10:35:21Z
"{'id': None, 'name': 'Forbes'}","Mutant Year Zero: Zone Wars offers a tabletop skirmish battle game that's easy to learn, fast to ... [+] play and full of wild twists of fate.
Free League Publishing
Post-apocalyptic stories are st… [+4246 chars]",Battle For The Fate Of Mutant Year Zero In Zone Wars,2024-06-28T19:34:09Z
"{'id': None, 'name': 'IndieWire'}","The private literary collection of late publishing tycoon and editor Robert Gottlieb will be showcased by Metrograph‘s Summer Book Fair. 
IndieWire can exclusively announce that the late former edit… [+2192 chars]",The Metrograph Summer Book Fair Will Celebrate Legendary Editor Robert Gottlieb’s Private Collection,2024-06-17T20:00:00Z
"{'id': None, 'name': 'Forbes'}","A Writing Room is one of the fast-growing writer collectives. The four co-founders (left to right): ... [+] Reese Zecchin, Director of Production; Jacob Nordby, Director of Writer Development; A. Ash… [+9318 chars]","A Writing Room: The New Marketplace Of Writer Classes, Retreats, And Collectives",2024-06-25T13:49:54Z
"{'id': None, 'name': 'Forbes'}","Customers experience 2023's Galaxy Z Fold5 at a Samsung sales store (Photo credit should read ... [+] CFOTO/Future Publishing via Getty Images)
Future Publishing via Getty Images
Samsung is putting… [+1606 chars]",New Samsung Exclusive Reveal Galaxy Z Fold6 Advantages,2024-07-01T23:29:42Z
"{'id': None, 'name': 'Forbes'}","Amazon provides a number of great money making opportunities.
Future Publishing via Getty Images
Its clear that Amazon has become a giant in the retail space, but what you may not know is that ther… [+10279 chars]",How To Make Money On Amazon — 6 Strategies,2024-07-05T16:00:00Z
"{'id': None, 'name': 'Forbes'}","The Covert Code by Anna Covert is released with Forbes Books
This release is posted on behalf of Forbes Books (operated by Advantage Media Group under license).
NEW YORK (June 18, 2024)The Covert C… [+3099 chars]",Covert Communication Founder Offers Blueprint For Digital Marketing Excellence,2024-06-18T12:00:00Z
"{'id': None, 'name': 'Forbes'}","A Culture of Promise by Fee Stubblefield is released with Forbes Books.
This release is posted on behalf of Forbes Books (operated by Advantage Media Group under license).
NEW YORK (June 25, 2024)A… [+3070 chars]",Senior Living CEO Presents Pioneering Vision For The Future Of Housing And Care For Older Adults,2024-06-25T13:21:28Z
"{'id': None, 'name': 'Forbes'}","DONETSK OBLAST, UKRAINE - JULY 4: Ukrainian soldiers on an M113 armored personnel carriers during ... [+] exercises on July 4, 2023 in Donetsk Oblast, Ukraine. (Photo by Viktor Fridshon/Global Images… [+5765 chars]",Newest American Aid Package Includes 200 M113s For Ukraine,2024-06-13T13:15:43Z
"{'id': None, 'name': 'Forbes'}","MELBOURNE, AUSTRALIA - NOVEMBER 14: Joe Elliott of Def Leppard performs at Marvel Stadium on ... [+] November 14, 2023 in Melbourne, Australia. (Photo credit should read Chris Putnam/Future Publishin… [+1896 chars]",Def Leppard Debuts Inside The Top 10 With Their New Single,2024-06-21T12:30:00Z
"{'id': 'espn', 'name': 'ESPN'}","Heorhiy Sudakov is considered one of the best players in the Ukraine side already. Pat Elmont - UEFA/UEFA via Getty Images
Ukraine manager Serhiy Rebrov doesn't like talking about individuals. Asked… [+10675 chars]",Why Ukraine's Sudakov is one of the most sought-after players in Europe,2024-06-25T11:51:48Z
"{'id': None, 'name': 'Forbes'}","DNIPRO, UKRAINE - JULY 3, 2024 - A woman is comforted near a shopping mall damaged by the Russian ... [+] missile strike in Dnipro, east-central Ukraine, on Wednesday morning, July 3. At least five p… [+3604 chars]","Friday, July 5. Russia’s War On Ukraine: News And Information From Ukraine",2024-07-04T22:42:15Z
"{'id': None, 'name': 'Forbes'}","BRAZIL - 2022/05/20: In this photo illustration, the Adobe Inc. logo seen displayed on a smartphone ... [+] screen. (Photo Illustration by Rafael Henrique/SOPA Images/LightRocket via Getty Images)
S… [+4371 chars]",Earnings Preview: What To Expect From Adobe,2024-06-13T16:24:01Z
"{'id': None, 'name': 'Forbes'}","Illustration of an asteroid racing towards Earth, created on July 19, 2015. (Illustration by Tobias ... [+] Roetsch/Future Publishing via Getty Images)
Future Publishing via Getty Images
An asteroi… [+2527 chars]",Stadium-Sized Asteroid Coming Closer Than Our Moon Is Easiest To See In Years,2024-06-23T13:44:11Z
"{'id': None, 'name': 'Forbes'}","SHANGHAI, CHINA - NOVEMBER 6, 2023 - A Micron logo is seen at the 6th CIIE 2023 in Shanghai, China, ... [+] November 6, 2023. (Photo credit should read CFOTO/Future Publishing via Getty Images)
Futu… [+3296 chars]",Our Digital Infrastructure Theme Which Includes Micron And Nvidia Surges 30% This Year On AI Demand. What’s Next?,2024-07-01T09:00:00Z
"{'id': None, 'name': 'Forbes'}","The new Twitch app is a step backwards. (Photo by Phil Barker/Future Publishing via Getty Images)
Future Publishing via Getty Images
A few weeks ago Twitch rolled out an update to some users of its… [+3160 chars]",The New Twitch Mobile App Has Made Me Hate The Platform I Use Most,2024-06-15T15:44:54Z
"{'id': None, 'name': 'Forbes'}",The original watercolor painting that was later used as the cover art for the first ever Harry Potter book shattered a franchise memorabilia record when it sold at Sothebys auction house in New York … [+3379 chars],This Harry Potter Item Just Became The Most Expensive Ever Sold At Auction—By Almost 400%,2024-06-26T17:32:33Z
"{'id': None, 'name': 'Forbes'}","Updated July 2 with Samsungs promotion billboards: article originally posted July 1.
Customers experience 2023's Galaxy Z Fold5 at a Samsung sales store (Photo credit should read ... [+] CFOTO/Futur… [+2653 chars]",New Samsung Images Reveal Galaxy Z Fold6 Design Advantages,2024-07-02T21:02:15Z
"{'id': None, 'name': 'Forbes'}","Customers shop for iPhone 15 at Apple's flagship store in Hangzhou (Photo: CFOTO/Future Publishing ... [+] via Getty Images)
Future Publishing via Getty Images
New iPhone 16 leaks have suggested se… [+2587 chars]","Latest iPhone 16 Leak Reveals Updated Camera, New Buttons",2024-06-22T22:03:27Z
"{'id': None, 'name': 'Forbes'}","Updated June 23 with new case and charger details: article originally posted June 22.
Customers shop for iPhone 15 at Apple's flagship store in Hangzhou (Photo: CFOTO/Future Publishing ... [+] via G… [+3572 chars]","Latest iPhone 16 Leak Reveals Updated Camera, New Buttons",2024-06-23T16:28:34Z
"{'id': None, 'name': 'Forbes'}","SHANGHAI, CHINA - MARCH 14, 2024 - Visitors visit the Galaxy S24 phones at SAMSUNG booth at AWE2024 ... [+] in Shanghai, China, March 14, 2024. (Photo credit should read CFOTO/Future Publishing via G… [+2670 chars]",Samsung Makes A New Storage Offer To Galaxy S24 Buyers,2024-06-29T16:57:54Z
"{'id': 'nbc-news', 'name': 'NBC News'}","EXETER, N.H. Bestselling author Brendan DuBois was arraigned Thursday on multiple counts of possessing child sexual abuse materials after police discovered dozens of sexually explicit conduct.
DuBoi… [+1280 chars]",Bestselling author Brendan DuBois charged with possessing child sexual abuse materials,2024-07-12T08:07:46Z
"{'id': None, 'name': 'Forbes'}","The price of Bitcoin fell below $59,000 for the first time since April early on Thursday, with several other major cryptocurrencies slumping as well, amid concerns about the impact of the defunct Mt.… [+1831 chars]","Bitcoin Price Drops Below $59,000 For The First Time Since April",2024-07-04T06:58:46Z
"{'id': 'cbs-news', 'name': 'CBS News'}","Watch CBS News
Copyright ©2024 CBS Interactive Inc. All rights reserved.
Get browser notifications for breaking news, live events, and exclusive reporting.
Not NowTurn On",Julian Assange lands in Australia a free man after plea deal,2024-06-27T00:28:00Z
"{'id': None, 'name': 'Forbes'}","Your to-do list can be helpful or hurtful, depending on how you use it.
getty
Theres never a shortage of productivity tips, tricks, and tools popping up online, butwhile some are beneficialmany peo… [+6969 chars]",5 To-Do List Mistakes That Might Be Making You Less Productive,2024-06-17T15:51:29Z
"{'id': None, 'name': 'IndieWire'}","Editor’s note: This story was originally published on June 20, 2017, in celebration of the 42nd anniversary of the release of “Jaws.” We are re-publishing it today with some light updates to celebrat… [+5519 chars]",How ‘Jaws’ Forever Changed the Modern Day Blockbuster — and What Today’s Examples Could Learn from It,2024-06-18T16:45:05Z
"{'id': None, 'name': 'Forbes'}","Rebecca Liao is Co-founder and CEO of Saga.
getty
Last year, gaming was eating media (paywall). This year, even gaming is realizing that no one is exempt from media trends. As the industry struggle… [+6015 chars]","AI, Web3 And The Coming Indie Gaming Revolution",2024-07-08T12:45:00Z
"{'id': 'cbs-news', 'name': 'CBS News'}","Watch CBS News
Copyright ©2024 CBS Interactive Inc. All rights reserved.
Get browser notifications for breaking news, live events, and exclusive reporting.
Not NowTurn On",The Internet Archive's Wayback Machine,2024-06-23T14:22:00Z
"{'id': None, 'name': 'Forbes'}","Rescuers respond to the Russian missile attack on central Vinnytsia, central Ukraine. Over twenty ... [+] civilians are reported killed after Kalibr cruise missiles launched by the Russian military f… [+4357 chars]",U.N. Body To Consider Russia’s Mass Killing Of Civilians In Ukraine,2024-07-12T20:18:08Z
"{'id': None, 'name': 'Forbes'}","Consider these two recently released books for summer reading and cooking.
Modern Asian KitchenEssential and Easy Recipes for Ramen, Dumplings, Dim Sum, Stir-Fries, Rice Bowls, Pho, Bibimbaps, and M… [+5725 chars]",New Books To Relish—Asian Cooking And A History Of Italy Through Wine,2024-06-16T08:12:59Z
"{'id': None, 'name': 'Forbes'}","In this photo provided by the 24th Mechanised brigade press service, remaining local residents leave ... [+] their home town of Toretsk in Donetsk region, Ukraine, Thursday, June 13, 2024. Many towns… [+5896 chars]","Tuesday, June 18. Russia’s War On Ukraine: News And Information From Ukraine",2024-06-18T14:09:46Z
"{'id': None, 'name': 'Forbes'}","Retail is being reinvented.
New business models, channel expansion and shopper expectations continue to change the landscape. These three areas redefine industry rules and relationshipstransforming … [+5339 chars]","How Retailers Should Navigate New Models, Channels And Shoppers",2024-06-20T12:15:00Z
"{'id': None, 'name': 'Forbes'}","Heres how you know Apple is getting stuff right: when it introduces a feature youve never thought of but as soon as its here, you think, of course, thats brilliant. Well, thats what the latest-announ… [+2327 chars]",Apple iPhone 16 To Gain Unique Feature Upgrade In Coming Weeks,2024-07-03T22:30:07Z
"{'id': None, 'name': 'Forbes'}","Apple has issued an update for AirPods, after a flaw was discovered that could allow an attacker to ... [+] connect their device to your headphones and potentially eavesdrop on your conversations.
F… [+2440 chars]",Apple Issues New AirPods Security Update For Eavesdropping Flaw,2024-06-28T15:13:11Z
"{'id': None, 'name': 'Forbes'}",UNSPECIFIED - CIRCA 1970: Photo of Creedence Clearwater Revival Photo by Michael Ochs ... [+] Archives/Getty Images. Creedence Clearwater Revivals Chronicle: The 20 Greatest Hits becomes just the fif… [+1996 chars],Creedence Clearwater Revival Joins Metallica And Pink Floyd As They Make History,2024-07-02T15:00:16Z
"{'id': 'nbc-news', 'name': 'NBC News'}","WASHINGTON WikiLeaks founder Julian Assange plans to plead guilty as part of a plea deal with the U.S. Justice Department that will allow him to go free after spending five years in a British prison,… [+3467 chars]","Julian Assange has reached a plea deal with the U.S., allowing him to go free",2024-06-24T23:02:39Z
"{'id': None, 'name': 'Forbes'}","Chinese fried rice
The Art of Canine Cuisine
Our adorable, beloved pets arent just our best friends, but are also a part of our families. Its safe to say that while sharing meals with loved ones is… [+8137 chars]",The Art Of Canine Cuisine: The Ultimate Book For Foodies With Dogs,2024-07-09T17:54:08Z
"{'id': None, 'name': 'Forbes'}","As the days get longer and a little more carefree, there's no better time to pursue new culinary adventures. Whether you're a seasoned home chef or just starting to dabble in the kitchen, theres a ha… [+9724 chars]",The 13 Best Cookbooks Of Summer 2024,2024-06-21T03:20:40Z
"{'id': None, 'name': 'Forbes'}","Learn how to get paid to write for beginners and much more. 
getty
Do you have a way with words? You could turn your prowess with pronouns, verbs and adjectives into a lucrative side hustle when yo… [+13814 chars]",How To Make Money Writing – 6 Ideas,2024-06-30T16:00:00Z
"{'id': None, 'name': 'Forbes'}","As Barbie celebrates her 65th anniversary, the spotlight is on Mattel to see if they can keep the ... [+] momentum going from last years blockbuster Barbie movie and the cultural phenomenon of Barben… [+6959 chars]",A Year After The Barbie Movie: Can The Dollhouse Keep The Lights On & Shining Bright?,2024-07-07T20:18:04Z
"{'id': None, 'name': 'Forbes'}","The future of work will definitely include more robots that ever before. The question is will they ... [+] be humanoid or specialized?
getty
For decades, science fiction has presented a robotic fut… [+6385 chars]",Is The Future Of Robotics Specialized Or Humanoid? It Depends,2024-06-28T02:53:32Z
"{'id': None, 'name': 'Forbes'}","Her popularity is impacting the GDP of some countries. Cities are bending over backwards for more, but they are missing the big picture. Lets use that as proof that investing in our local music ecosy… [+6326 chars]",Why Isn’t Taylor Swift Making Cities Take Music More Seriously?,2024-07-10T10:58:19Z
"{'id': None, 'name': 'IndieWire'}","[Editor’s note: This story contains spoilers for all of Season 3 of Netflix’s “Bridgerton,” including the ending.]
When speaking to IndieWire ahead of “Bridgerton” Season 3 Part 1, new showrunner Je… [+7234 chars]",‘Bridgerton’ Season 3 Loses Steam Before Rallying to a Satisfying Finish,2024-06-13T23:00:00Z
"{'id': None, 'name': 'Forbes'}","Robert F. Kennedy Jr. apologized to a woman who accused him of sexually assaulting her in the 1990s, though he said he didnt remember the incident, according to screenshots of texts shared by the acc… [+3274 chars]",RFK Jr Texts Apology To Woman Who Accused Him Of Sexual Assault,2024-07-12T17:58:09Z
"{'id': None, 'name': 'Forbes'}","Updated July 12 with new chassis design details.
Galaxy S24 Ultra on show at Galaxy Unpacked, January 17 2024, London, United Kingdom.
EWAN SPENCE
Samsung may have revealed the Galaxy Z Fold6 and … [+2681 chars]",Samsung Documents Confirm Galaxy S25 Ultra Details,2024-07-12T23:16:35Z
"{'id': None, 'name': 'Forbes'}","At the WWDC, Apple officially released Apple Intelligence, joined hands with OpenAI, and added ... [+] ChatGPT to Siri.
CFOTO/Future Publishing via Getty Images
At Apple's Worldwide Developers Conf… [+3198 chars]",Is Apple’s Deal With OpenAI Good For Both Companies Or Only Apple?,2024-06-14T14:00:00Z
"{'id': None, 'name': 'Forbes'}","The Secret To Going Further In Business: Invest In Yourself
getty
Business success often hinges on more than just a great idea or a solid work ethic. For women in particular, investing in oneself c… [+3496 chars]",The Secret To Going Further In Business: Invest In Yourself,2024-06-19T10:00:00Z
"{'id': None, 'name': 'Forbes'}","NOLAN, TEXAS - OCTOBER 04: An oil pumpjack is seen near a field of wind turbines on October 04, 2023 ... [+] in Nolan, Texas. The U.S. oil industry had a record-breaking year as the crude market cont… [+3790 chars]",Breaking Records: 2024 Statistical Review Of World Energy Highlights,2024-06-22T21:57:57Z
"{'id': None, 'name': 'Forbes'}","Teens in circle holding smart mobile phones - Multicultural young people using cellphones outside - ... [+] Teenagers addicted to new technology concept
getty
For independent contractors selling se… [+3038 chars]",5 Social Media Hacks For Anyone Who Works For Themselves,2024-06-13T08:18:00Z
"{'id': None, 'name': 'Forbes'}","American actor Gregory Peck (1916 - 2003) as Dr. Josef Mengele in the thriller 'The Boys from ... [+] Brazil', 1978. (Photo by Silver Screen Collection/Getty Images)
Getty Images
Ira Levins classic… [+3420 chars]",Ira Levin’s Classic Thriller ‘The Boys From Brazil’ Receiving New Adaptation From ‘The Crown’ Creator,2024-06-21T21:12:59Z
"{'id': None, 'name': 'Forbes'}","Microsoft's AI chief suggested anything found online is freeware
NurPhoto via Getty Images
Content that has been posted on the open web should be treated as freeware, according to Microsofts AI chi… [+3536 chars]",Has Microsoft’s AI Chief Just Made Windows Free?,2024-07-01T15:20:21Z
"{'id': None, 'name': 'Forbes'}","Gautam Adani, chairman of Adani Group, center, attends a swearing-in ceremony for Narendra Modi, ... [+] India's prime minister, not pictured, at the Rashtrapati Bhawan in New Delhi, India, on Sunday… [+3392 chars]",Adani Short Seller Hindenburg Dismisses Show Cause Notice From Indian Securities Regulator,2024-07-03T00:49:24Z
"{'id': None, 'name': 'Forbes'}","Nvidia stocks historic rally was doused further Monday, as shares of the artificial intelligence technology dominator are mired in one of their worst stretches in years, cutting into their still impr… [+3073 chars]",Nvidia Stock Sinks Another 5%—Market Cap Down $500 Billion From Last Week’s Peak,2024-06-24T15:40:32Z
"{'id': None, 'name': 'Forbes'}","Opportunities exist in Small-Cap Stocks
Copyright 2018 The Associated Press. All rights reserved.
With Small Cap stocks stuck in neutral this year from a performance standpoint, it is worthwhile re… [+3346 chars]",Small-Cap Stocks: Good Things Need Not Have A Large Package,2024-06-28T22:25:21Z
"{'id': 'nbc-news', 'name': 'NBC News'}",Hunter Biden is accusing Fox News in a lawsuit of distributing revenge porn by broadcasting nude images of him as part of a miniseries that was available on the conservative outlets streaming service… [+1711 chars],Hunter Biden sues Fox News under New York’s ‘revenge porn’ law,2024-07-01T18:58:34Z
"{'id': 'nbc-news', 'name': 'NBC News'}","Kinky Friedman, the satirical and often provocative musician, author and one-time politician, has died at the age of 79.
Kinky Friedman stepped on a rainbow at his beloved Echo Hill surrounded by fa… [+2143 chars]","Kinky Friedman, provocative musician, author and one-time politician, dies at 79",2024-06-27T17:24:16Z
"{'id': None, 'name': 'Forbes'}","Jiahao Sun, Founder and CEO of FLock.io.
getty
Apple's recent unveiling of Apple Intelligence, a powerful generative AI system integrated into its mobile operating systems, marks a significant mile… [+5309 chars]",Apple Intelligence: A Double-Edged Sword For The Commerce Landscape,2024-07-09T13:00:00Z
"{'id': None, 'name': 'Forbes'}","Jenya Edelberg is the CTO of martech consultancy The Destiny Lab.
getty
Martech options available today emphasize data analytics, automation and reporting. While many solutions are ready to be used… [+5406 chars]",Mastering MarTech On A Tight Budget,2024-07-10T14:00:00Z
"{'id': None, 'name': 'Forbes'}","Nick Baudoin turned a freelance business he started on Upwork into a fast-growing design development and marketing agency, and hes on track for $2.6 million in revenue for 2024.
Baudoin, based in Ho… [+5917 chars]","He Tapped His Freelance Experience To Build A Fast-Growing, 7-Figure Agency",2024-07-12T02:04:52Z
"{'id': None, 'name': 'Forbes'}","My Lady Jane
Credit: Amazon
I wasnt sure if Id be the target audience for Prime Videos new period romance My Lady Jane and I admit that in the first few minutes I considered turning it off and watc… [+5155 chars]",‘My Lady Jane’ On Prime Video Is Surprisingly Great,2024-07-03T20:30:47Z
"{'id': None, 'name': 'Forbes'}","A super PAC that backs Sen. Ted Cruz, R-Texas, received another $150,000 in digital revenue from iHeartMedia in May, despite a recent complaint alleging the money from iHeart violates federal campaig… [+4652 chars]","Pro-Ted Cruz Super PAC Gets Another $150,000 From iHeartMedia For Podcast—Despite FEC Complaint",2024-06-20T18:19:29Z
"{'id': None, 'name': 'Forbes'}","Amir Khayat, CEO &amp; Co-Founder of Vorlon.
getty
On May 15, 2024exactly one year after the proposed changesthe Securities and Exchange Commission adopted amendments to Regulation S-P, the rules t… [+6484 chars]",Enhancing Organizational Security In The Wake Of Regulation Amendments,2024-06-17T11:15:00Z
"{'id': None, 'name': 'Forbes'}","(Ad screen shot courtesy of iSpot.TV)
Stop the presses (or whatever we use these days in publishing)! The years-long fight between Apple and Meta driven by the iPhone makers iron control over its va… [+4449 chars]",Man Bites Dog As Meta Reportedly Negotiating To Join Apple AI Offering,2024-06-24T22:08:12Z
"{'id': None, 'name': 'Forbes'}","Applying for remote jobs in the summer gives you a competitive edge, as other job seekers will be ... [+] more inclined to resume their efforts in the fall
getty
Are you taking a break from applyin… [+4532 chars]",30 Flexible Companies Now Hiring Fully Remote Jobs In 2024,2024-06-30T10:00:00Z
"{'id': None, 'name': 'Forbes'}","EDITORS NOTE: Graphic content / Communal workers excavate the body of an elderly man who died ... [+] following an aerial bomb explosion in Kharkiv, on June 23, 2024, amid the Russian invasion of Ukr… [+5616 chars]","Tuesday, June 25. Russia’s War On Ukraine: News And Information From Ukraine",2024-06-26T04:19:20Z
"{'id': None, 'name': 'Forbes'}","Elena Reygadas, chef and owner of Mexico City's Rosetta, which was recently bestowed a Michelin ... [+] star.
Maureen Evans
Elena Reygadas has had a busy and exciting last couple of years. The chef… [+4887 chars]",Rosetta Chef Elena Reygadas Reaches Michelin Stardom In Mexico City,2024-06-26T17:05:02Z
"{'id': None, 'name': 'Forbes'}","Apple investors are likely riding high after the iPhone makers stock enjoyed a historic week, but Wall Street forecasts suggest there may not be much near-term upside for Apples share price even as a… [+4310 chars]",Can Apple Stock Go Much Higher? Analysts Don't Think So: Here's Why.,2024-06-15T12:00:00Z
"{'id': None, 'name': 'Forbes'}","Muhammad Eltiti, Partner &amp; Director of Performance at BOOST.
Getty
Have you ever wondered why some brands seem to be everywhere in your digital experiences? Whether you're scrolling through you… [+4748 chars]",Using Omnipresence To Enhance Your Brand Recognition,2024-06-26T11:15:00Z
"{'id': None, 'name': 'Forbes'}","Techo International Airport is scheduled to open in 2025.
Foster + Partners
Frances Lagardère Travel Retail has wrapped up a significant deal in Cambodia where, for the first time in Asia-Pacific, … [+4146 chars]",Lagardere Strikes Landmark Deal In Cambodia Using Profit-Sharing Model,2024-06-30T17:17:15Z
"{'id': None, 'name': 'Forbes'}","The recent sale of a 1 cent Ben Franklin stamp for $4.4 million, the most expensive U.S. stamp ever sold, again raises for consideration the question, Are postage stamps good investments? Certainly B… [+3861 chars]",ARE POSTAGE STAMPS GOOD INVESTMENTS? Part 1,2024-06-17T22:32:36Z
"{'id': None, 'name': 'Forbes'}","Dr. Laurence Lock Lee, cofounder and Chief Scientist, SWOOP Analytics.
getty
Internal communications (IC) is regularly seen as the mouthpiece for executive management (the megaphone), crafting inte… [+6444 chars]",From Megaphones To Conversations: Redefining Internal Communication Success,2024-06-18T10:15:00Z
