source,content,headline,date_published
"{'id': None, 'name': 'Forbes'}","On a Tuesday night in May, Mike Will Made-It, CEO of Ear Drummers Entertainment, is sitting in his all-black, fully loaded 2023 Range Rover, admiring the Atlanta skyline. Now I understand evolution, … [+5820 chars]",How Mike Will Made-It Is Making It In Business,2024-06-23T10:00:00Z
"{'id': None, 'name': 'Forbes'}","TURIN, ITALY - MAY 7: Juventus Creator Lab General Views on May 7, 2024 in Turin, Italy. (Photo by ... [+] Daniele Badolato - Juventus FC/Juventus FC via Getty Images)
Juventus FC via Getty Images
… [+4964 chars]",‘The Sports Industry Needs A Revolution’: Inside Juventus Creator Lab,2024-06-24T12:18:03Z
"{'id': None, 'name': 'Forbes'}","Frederik Bussler is the Gen Z owner of Bussler &amp; Co, a New York marketing firm.
getty
The business landscape is undergoing a shift that threatens countless agencies. A perfect storm of globaliz… [+5421 chars]",Surviving The Agency Apocalypse In A Hypercompetitive Market,2024-06-24T11:00:00Z
"{'id': None, 'name': 'Forbes'}","President of Xsolla, the business engine for gaming since 2005, processes 700+ global payment methods in 200+ regions, and in 20 languages.
getty
Since the early days of Atari and Coleco, the gamin… [+4659 chars]",Leveling Up: How Education Fuels Growth In The Gaming Industry,2024-07-01T12:30:00Z
"{'id': None, 'name': 'Forbes'}","Updated July 4 with details of other upcoming Apple TV and home device news. 
Heres how you know Apple is getting stuff right: when it introduces a feature youve never thought of but as soon as its … [+3572 chars]",Apple iPhone 16 To Gain Unique Feature Upgrade In Coming Weeks,2024-07-04T19:52:59Z
"{'id': None, 'name': 'Forbes'}","Updated July 6 with details of other upcoming Apple TV news, more features coming in tvOS 18 this fall, and home device news. 
Heres how you know Apple is getting stuff right: when it introduces a f… [+5052 chars]",Apple iPhone 16 To Gain Unique Feature Upgrade In Coming Weeks,2024-07-06T19:45:42Z
"{'id': 'nbc-news', 'name': 'NBC News'}","VATICAN CITY Italian Archbishop Carlo Maria Vigano, a fierce ultra-conservative critic of Pope Francis, has been found guilty of schism and excommunicated, the Vaticans doctrinal office said on Frida… [+2939 chars]",Papal arch enemy Archbishop Vigano found guilty of schism and excommunicated,2024-07-06T09:44:02Z
"{'id': 'nbc-news', 'name': 'NBC News'}","Boeings Starliner capsule Calypso will stay at the International Space Station twice as long as the mission originally planned, NASA announced Friday.
This developmental nature of the mission, known… [+3754 chars]","Boeing and NASA delay Starliner astronaut return to June 22, nearly doubling mission length to test spacecraft",2024-06-14T19:25:11Z
"{'id': 'cbs-news', 'name': 'CBS News'}",Washington — WikiLeaks founder Julian Assange has agreed to plead guilty to violating the Espionage Act and is expected to appear in a U.S. courtroom on the Northern Mariana Islands in the coming day… [+4621 chars],"Julian Assange, WikiLeaks founder, to plead guilty to violating the Espionage Act",2024-06-24T23:11:24Z
"{'id': 'cbs-news', 'name': 'CBS News'}","Positive thinking wasn't enough to help Chicken Soup for the Soul Entertainment escape a pile of unpaid bills.
The publisher of uplifting books, TV, movie and online video content, which also owns D… [+2205 chars]","Chicken Soup for the Soul, awash in debt, declares bankruptcy",2024-07-01T20:57:58Z
"{'id': None, 'name': 'IndieWire'}","On Friday nights, IndieWire After Dark takes a feature-length beat to honor fringe cinema in the streaming age. 
First, the spoiler-free pitch for one editor’s midnight movie pick — something weird … [+11876 chars]",‘Andaz Apna Apna’: The Best Bollywood (Midnight?) Movie the West Has Never Heard About,2024-06-29T03:59:00Z
"{'id': None, 'name': 'Forbes'}","getty
Generative artificial intelligences applications are both innovative and diverse, and it has the potential to fundamentally change workflows, boost creativity and increase efficiency in unexpe… [+8707 chars]",20 Surprising Functions And Fields GenAI Is Revolutionizing (And How),2024-07-08T17:15:00Z
"{'id': None, 'name': 'Forbes'}","Inside The Blueprint Underground Cocktail Club in Nashville
Courtesy of The Blueprint Underground Cocktail Club 
Actor, TV personality, and serial entrepreneur Billy Dec opened the famous Undergrou… [+6500 chars]",Nashville’s Newest Nightspot - The Blueprint Underground Cocktail Club In Printers Alley,2024-07-12T23:24:16Z
"{'id': None, 'name': 'Forbes'}","Stephen Turban is one of the founders of Lumiere Education and a Harvard College graduate. 
getty
As standards for college applicants increase in difficulty, many are focusing more on their high sc… [+6619 chars]",6 Lessons From High School Research For Job Searchers,2024-07-12T12:30:00Z
"{'id': None, 'name': 'Forbes'}","SANTA FE, NEW MEXICO - OCTOBER 7, 2020: A woman wears a Patagonia jacket. (Photo by Robert ... [+] Alexander/Getty Images)
Getty Images
Patagonia just pulled off the brand image upset of ages by th… [+7303 chars]",Why Patagonia’s Return To Office Mandate Feels Off And How Others Thrive Remotely,2024-07-12T16:00:00Z
"{'id': None, 'name': 'Forbes'}",A new study published in the New York Times demonstrates some startling findings about loss of ability to make money decisions in older people. The study approaches the issue by looking at debt accum… [+6215 chars],Why Aging Parents With Memory Loss Must Stop Managing Money,2024-06-13T17:53:35Z
"{'id': None, 'name': 'Forbes'}","Woman is shopping in supermarket and scanning barcode with smartphone
getty
Closed-end funds (CEFs) are my No. 1 income plays for a reason that goes beyond their huge dividends: We can tap these of… [+5695 chars]",The Secret Behind These 2 Heavily Discounted CEFs,2024-06-25T12:30:00Z
"{'id': None, 'name': 'Forbes'}","Theres a slew of glossy, new travel books hitting bookshelves this monthperfect for inspiring you for your next travels.
The Puglian table is the inspiration behind Moroseta Kitchen by Giorgia Eugen… [+7471 chars]",Take A Leaf Out Of The Latest Travel Books,2024-06-25T12:28:46Z
"{'id': None, 'name': 'Forbes'}","Photo by NICOLAS MAETERLINCK/BELGA MAG/AFP via Getty Images
BELGA MAG/AFP via Getty Images
On writing, author David Sedaris once said, You need to do the best that you can do, and then you need to … [+7175 chars]",7 ChatGPT Prompts To Improve Your Writing,2024-06-25T12:32:53Z
"{'id': None, 'name': 'Forbes'}","Eric Muhlheim has been the CFO of Mozilla since November 2021.
Courtesy of Mozilla
At the helm of Mozillas financial operations is CFO Eric Muhlheim. Known for creating the Firefox browser, Mozilla… [+7798 chars]",Eric Muhlheim: Behind The Goals And Growth Of Mozilla,2024-06-14T09:00:00Z
"{'id': None, 'name': 'Forbes'}","Kantrell Betancourt is bullish on the use of AI for creative endeavors like art. 
Kantrell Betancourt 
In a press release issued in mid-April, community builder startup Groundfloor announced an in-… [+6511 chars]","Kantrell Betancourt Talks New Midjourney Book, AI As Assistive Tech In Interview",2024-06-14T21:59:26Z
"{'id': None, 'name': 'Forbes'}","Ana Bubolea is the Founder of Buzzworthy Brands. Follow me on LinkedIn for daily personal branding insights.
getty
I still remember the day I realized the true power of thought leadership.
It was … [+7035 chars]",The Ultimate ROI Of Your Brand Impact And Thought Leadership,2024-06-20T13:45:00Z
"{'id': None, 'name': 'Forbes'}","Silvano Marchetto, owner of Da Silvano restaurant in New York, where Princess Michael of Kent denied ... [+] making a racist comment to a group of diners. Her spokesman said the claim, reported on th… [+5751 chars]",Remembering Silvano Marchetto: He Brought Casual Chic And A World Of Celebs To His Greenwich Village Trattoria Da Silvano,2024-06-25T14:57:03Z
"{'id': None, 'name': 'Forbes'}","getty
Organic engagement and authentic content can take your next marketing campaign to new heights. To make that happen, more and more brands have begun partnering with influencers, utilizing their… [+7734 chars]",16 Ways To Vet An Influencer Before Partnering With Them,2024-06-24T17:15:18Z
"{'id': None, 'name': 'Forbes'}",TOPSHOT - Vogue Editor-in-Chief Anna Wintour poses during a photocall upon arrival to attend the ... [+] Spring/Summer 2025 menswear ready to wear joint fashion show hosted by Vogue World as part of … [+6846 chars],Vogue Closes Paris Fashion Week With A Grand Show On The Place Vendôme,2024-06-24T11:04:20Z
